UsageClass,CheckoutType,MaterialType,CheckoutYear,CheckoutMonth,Checkouts,Title,ISBN,Creator,Subjects,Publisher,PublicationYear,BookGroup
Digital,OverDrive,EBOOK,2025,12,8,White Rage: The Unspoken Truth of Our Racial Divide,9781632864147,Carol Anderson,"History, Law, Sociology, Nonfiction",Bloomsbury Publishing,2016,Treatment
Digital,OverDrive,AUDIOBOOK,2025,6,185,Sapiens: A Brief History of Humankind (unabridged),9780062796233,Yuval Noah Harari,"History, Philosophy, Science, Nonfiction",HarperCollins,2018,Control
Digital,OverDrive,AUDIOBOOK,2025,5,33,How to Win Friends and Influence People: Updated For the Next Generation of Leaders (unabridged),9781797140834,Dale Carnegie,"Business, Psychology, Nonfiction, Self Help",Simon & Schuster Audio,2022,Control
Physical,Horizon,BOOK,2025,7,1,White fragility : why it's so hard for white people to talk about racism / Robin DiAngelo.,"0807047414, 9780807047415","DiAngelo, Robin, 1956-","Racism, White people, Race relations","Beacon Press,",[2018],Treatment
Digital,OverDrive,EBOOK,2025,5,2,How to Be an Antiracist,9780525509295,Ibram X. Kendi,"Biography & Autobiography, Politics, Sociology, Nonfiction",Random House Publishing Group,2019,Treatment
Digital,OverDrive,Audiobook,2025,8,37,The Life-Changing Magic of Tidying Up: The Japanese Art of Decluttering and Organizing (unabridged),9781494528942,Marie Kondo,"Home Design & Décor, Philosophy, Self-Improvement, Nonfiction","Tantor Media, Inc",2015,Control
Digital,OverDrive,Audiobook,2025,8,4,Stamped from the Beginning: A Definitive History of Racist Ideas in America (unabridged),9781518940927,Ibram X. Kendi,"History, African American Nonfiction, Nonfiction",Novel Audio,2017,Treatment
Digital,OverDrive,EBOOK,2025,5,8,Untamed,9781984801265,Glennon Doyle,"Biography & Autobiography, Self-Improvement, Nonfiction",Random House Publishing Group,2020,LGBT
Digital,OverDrive,Ebook,2025,8,7,The Book of (More) Delights: Essays,9781643755472,Ross Gay,"Biography & Autobiography, Literary Criticism, African American Nonfiction, Nonfiction","Little, Brown and Company",2023,LGBT
Digital,OverDrive,Audiobook,2025,8,25,The Book of Delights:  (unabridged),9781501977640,Ross Gay,"Literary Criticism, Self-Improvement, Nonfiction","Recorded Books, Inc.",2019,LGBT
Digital,OverDrive,EBOOK,2025,10,5,Hunger: A Memoir of (My) Body,9780062362605,Roxane Gay,"Biography & Autobiography, Family & Relationships, Nonfiction",HarperCollins,2017,LGBT
Physical,Horizon,BOOK,2025,5,16,How to win friends and influence people : updated for the next generation of leaders / Dale Carnegie ; preface by Donna Dale Carnegie.,"1982171456, 9781982171452","Carnegie, Dale, 1888-1955,","Success, Influence Psychology, Interpersonal relations, Interpersonal communication, Self actualization Psychology","Simon & Schuster,",2022.,Control
Digital,OverDrive,EBOOK,2025,7,17,The New Jim Crow: Mass Incarceration in the Age of Colorblindness,9781620971949,Michelle Alexander,"Law, Politics, Sociology, African American Nonfiction, Nonfiction",The New Press,2020,Treatment
Digital,OverDrive,AUDIOBOOK,2025,5,34,"The New Jim Crow: Mass Incarceration in the Age of Colorblindness, 10th Anniversary Edition (unabridged)",9781464046162,Michelle Alexander,"Sociology, African American Nonfiction, Nonfiction","Recorded Books, Inc.",2018,Treatment
Digital,OverDrive,EBOOK,2025,5,5,Steve Jobs,9781451648553,Walter Isaacson,"Biography & Autobiography, Business, Computer Technology, Nonfiction",Simon & Schuster,2014,Control
Digital,OverDrive,AUDIOBOOK,2025,10,17,Hunger: A Memoir of (My) Body (unabridged),9780062470256,Roxane Gay,"Biography & Autobiography, Family & Relationships, Nonfiction",HarperCollins,2017,LGBT
Physical,Horizon,BOOK,2025,5,1,So you want to talk about race / Ijeoma Oluo.,"1580056776, 9781580056779","Oluo, Ijeoma","United States Race relations, Intercultural communication, Racism United States","Seal Press,",2018.,Treatment
Digital,OverDrive,EBOOK,2025,5,1,Naturally Tan: A Memoir,9781250208828,Tan France,"Biography & Autobiography, LGBTQIA+ (Nonfiction), Performing Arts, Nonfiction",St. Martin's Publishing Group,2019,LGBT
Digital,OverDrive,AUDIOBOOK,2025,6,53,Untamed:  (unabridged),9780593156087,Glennon Doyle,"Biography & Autobiography, Self-Improvement, Nonfiction",Books on Tape,2020,LGBT
Digital,OverDrive,AUDIOBOOK,2025,4,13,"Me and White Supremacy: Combat Racism, Change the World, and Become a Good Ancestor (unabridged)",9781094135458,Layla F. Saad,"Self-Improvement, Sociology, Nonfiction",Blackstone Publishing,2020,Treatment
Digital,OverDrive,EBOOK,2025,5,6,Stamped from the Beginning: The Definitive History of Racist Ideas in America,9781568584645,Ibram X. Kendi,"History, Sociology, Nonfiction",PublicAffairs,2016,Treatment
Digital,OverDrive,EBOOK,2025,7,10,In the Dream House: A Memoir,9781644451021,Carmen Maria Machado,"Biography & Autobiography, LGBTQIA+ (Nonfiction), Nonfiction",Graywolf Press,2019,LGBT
Digital,OverDrive,Ebook,2025,8,44,The Book of Delights: Essays,9781616208905,Ross Gay,"Biography & Autobiography, Literary Criticism, African American Nonfiction, Nonfiction","Little, Brown and Company",2019,LGBT
Physical,Horizon,BOOK,2025,5,3,White fragility : why it's so hard for white people to talk about racism / Robin DiAngelo.,"0807047414, 9780807047415","DiAngelo, Robin, 1956-","Racism, White people, Race relations","Beacon Press,",[2018],Treatment
Digital,OverDrive,EBOOK,2025,5,7,So You Want to Talk About Race,9781541619227,Ijeoma Oluo,"Politics, Sociology, African American Nonfiction, Nonfiction",Basic Books,2018,Treatment
Digital,OverDrive,AUDIOBOOK,2025,10,37,How to Be an Antiracist:  (unabridged),9781984832221,Ibram X. Kendi,"Biography & Autobiography, Politics, Sociology, Nonfiction",Books on Tape,2019,Treatment
Digital,OverDrive,EBOOK,2025,10,17,The Life-Changing Magic of Tidying Up: The Japanese Art of Decluttering and Organizing,9781607747314,Marie Kondo,"Home Design & Décor, Philosophy, Self-Improvement, Nonfiction",Clarkson Potter/Ten Speed,2014,Control
Digital,OverDrive,EBOOK,2025,5,31,The Boys in the Boat: Nine Americans and Their Epic Quest for Gold at the 1936 Berlin Olympics,9781101622742,Daniel James Brown,"History, Sports & Recreations, Nonfiction",Penguin Publishing Group,2013,Control
Digital,OverDrive,AUDIOBOOK,2025,5,33,The Life-Changing Magic of Tidying Up: The Japanese Art of Decluttering and Organizing (unabridged),9781494528942,Marie Kondo,"Home Design & Décor, Philosophy, Self-Improvement, Nonfiction","Tantor Media, Inc",2015,Control
Digital,OverDrive,AUDIOBOOK,2025,5,31,White Fragility: Why It's So Hard for White People to Talk About Racism (unabridged),9780807071168,Dr. Robin DiAngelo,"Family & Relationships, Self-Improvement, Sociology, Nonfiction",Beacon Press,2018,Treatment
Digital,OverDrive,Audiobook,2025,8,27,How to Be an Antiracist:  (unabridged),9781984832221,Ibram X. Kendi,"Biography & Autobiography, Politics, Sociology, Nonfiction",Books on Tape,2019,Treatment
Digital,OverDrive,EBOOK,2025,7,5,Sapiens [Tenth Anniversary Edition]: A Brief History of Humankind,9780063453982,Yuval Noah Harari,"History, Science, Nonfiction",HarperCollins,2025,Control
Digital,OverDrive,AUDIOBOOK,2025,9,36,How to Win Friends and Influence People: Updated For the Next Generation of Leaders (unabridged),9781797140834,Dale Carnegie,"Business, Psychology, Nonfiction, Self Help",Simon & Schuster Audio,2022,Control
Digital,OverDrive,EBOOK,2025,5,17,The New Jim Crow: Mass Incarceration in the Age of Colorblindness,9781620971949,Michelle Alexander,"Law, Politics, Sociology, African American Nonfiction, Nonfiction",The New Press,2020,Treatment
Digital,OverDrive,EBOOK,2025,10,20,Wild: From Lost to Found on the Pacific Crest Trail,9780307957658,Cheryl Strayed,"Biography & Autobiography, Travel, Nonfiction",Knopf Doubleday Publishing Group,2012,Control
Digital,OverDrive,AUDIOBOOK,2025,5,11,Bad Feminist: Essays (unabridged),9780062379764,Roxane Gay,"Essays, Sociology, Nonfiction, Humor (Nonfiction)",HarperAudio,2015,LGBT
Digital,OverDrive,AUDIOBOOK,2025,5,10,The Book of (More) Delights: Essays (unabridged),9781668632697,Ross Gay,"Biography & Autobiography, Literary Criticism, African American Nonfiction, Nonfiction",Hachette Audio,2023,LGBT
Digital,OverDrive,AUDIOBOOK,2025,6,9,"The Boys in the Boat: The True Story of an American Team's Epic Journey to Win Gold at the 1936 Olympics (unabridged,  young readers)",9781101925881,Daniel James Brown,"History, Sports & Recreations, Young Adult Nonfiction",Books on Tape,2018,Control
Physical,Horizon,BOOK,2025,6,8,When breath becomes air / Paul Kalanithi ; foreword by Abraham Verghese.,"081298840X, 9780812988406","Kalanithi, Paul","Kalanithi Paul Health, Lungs Cancer Patients United States Biography, Neurosurgeons Biography, Husband and wife","Random House,",[2016],Control
Digital,OverDrive,EBOOK,2025,5,6,The Boys in the Boat: The True Story of an American Team's Epic Journey to Win Gold at the 1936 Olympics,9780698197596,Daniel James Brown,"History, Juvenile Nonfiction, Sports & Recreations",Penguin Young Readers Group,2017,Control
Digital,OverDrive,EBOOK,2025,9,34,The Book of Delights: Essays,9781616208905,Ross Gay,"Biography & Autobiography, Literary Criticism, African American Nonfiction, Nonfiction","Little, Brown and Company",2019,LGBT
Digital,OverDrive,EBOOK,2025,6,6,Stamped from the Beginning: The Definitive History of Racist Ideas in America,9781568584645,Ibram X. Kendi,"History, Sociology, Nonfiction",PublicAffairs,2016,Treatment
Digital,OverDrive,Ebook,2025,8,2,Stamped from the Beginning: A Graphic History of Racist Ideas in America,9781984859457,Ibram X. Kendi,"Comic and Graphic Books, Nonfiction",Clarkson Potter/Ten Speed,2023,Treatment
Physical,Horizon,BOOK,2025,5,5,Steve Jobs / Walter Isaacson.,"1451648537, 9781451648539","Isaacson, Walter","Jobs Steve 1955 2011, Apple Computer Inc History, Computer engineers United States Biography, Chief executive officers United States Biography","Simon & Schuster,",2011.,Control
Digital,OverDrive,AUDIOBOOK,2025,5,60,Untamed (unabridged),9780593156087,Glennon Doyle,"Biography & Autobiography, Self-Improvement, Nonfiction",Books on Tape,2020,LGBT
Digital,OverDrive,AUDIOBOOK,2025,5,38,How to Be an Antiracist:  (unabridged),9781984832221,Ibram X. Kendi,"Biography & Autobiography, Politics, Sociology, Nonfiction",Books on Tape,2019,Treatment
Digital,OverDrive,EBOOK,2025,5,16,The Life-Changing Magic of Tidying Up: The Japanese Art of Decluttering and Organizing,9781607747314,Marie Kondo,"Home Design & Décor, Philosophy, Self-Improvement, Nonfiction",Clarkson Potter/Ten Speed,2014,Control
Digital,OverDrive,EBOOK,2025,10,11,Stamped from the Beginning: The Definitive History of Racist Ideas in America,9781568584645,Ibram X. Kendi,"History, Sociology, Nonfiction",PublicAffairs,2016,Treatment
Physical,Horizon,BOOK,2025,5,5,The boys in the boat (young readers edition)  : the true story of an American team's epic journey to win gold at the 1936 Olympics / Daniel James Brown ; adapted for young readers by Gregory Mone.,"0147516854, 1484489640, 9780147516855, 9780451475923, 9781484489642","Brown, Daniel James, 1951-","University of Washington Rowing History Juvenile literature, Olympic Games 11th 1936 Berlin Germany Juvenile literature, Rowing United States History Juvenile literature, Rowers United States Biography Juvenile literature, Biographies","Puffin Books,",2016.,Control
Digital,OverDrive,AUDIOBOOK,2025,6,3,Sapiens. De animales a dioses (Latino): Una breve historia de la humanidad (unabridged),9788499928265,Yuval Noah Harari,"History, Science, Sociology, Nonfiction",Penguin Random House Audio,2020,Control
Digital,OverDrive,EBOOK,2025,5,1,The Rules Do Not Apply: A Memoir,9780812996944,Ariel Levy,"Biography & Autobiography, Psychology, Sociology, Nonfiction",Random House Publishing Group,2017,LGBT
Digital,OverDrive,EBOOK,2025,7,26,Wild: From Lost to Found on the Pacific Crest Trail,9780307957658,Cheryl Strayed,"Biography & Autobiography, Travel, Nonfiction",Knopf Doubleday Publishing Group,2012,Control
Digital,OverDrive,EBOOK,2025,6,4,Bad Feminist: Essays,9780062282729,Roxane Gay,"Essays, Sociology, Nonfiction, Humor (Nonfiction)",HarperCollins,2014,LGBT
Digital,OverDrive,EBOOK,2025,9,3,The Book of (More) Delights: Essays,9781643755472,Ross Gay,"Biography & Autobiography, Literary Criticism, African American Nonfiction, Nonfiction","Little, Brown and Company",2023,LGBT
Digital,OverDrive,Audiobook,2025,8,8,So You Want to Talk about Race:  (unabridged),9781538475317,Ijeoma Oluo,"Politics, Sociology, African American Nonfiction, Nonfiction",Blackstone Publishing,2018,Treatment
Digital,OverDrive,EBOOK,2025,9,1,Shortest Way Home,9781631494376,Pete Buttigieg,"Biography & Autobiography, Politics, Nonfiction",Liveright,2019,LGBT
Digital,OverDrive,Audiobook,2025,8,34,In the Dream House: A Memoir (unabridged),9781684572793,Carmen Maria Machado,"Biography & Autobiography, LGBTQIA+ (Nonfiction), Nonfiction",HighBridge,2019,LGBT
Digital,OverDrive,EBOOK,2025,5,9,In the Dream House: A Memoir,9781644451021,Carmen Maria Machado,"Biography & Autobiography, LGBTQIA+ (Nonfiction), Nonfiction",Graywolf Press,2019,LGBT
Physical,Horizon,BOOK,2025,7,11,When breath becomes air / Paul Kalanithi ; foreword by Abraham Verghese.,"081298840X, 9780812988406","Kalanithi, Paul","Kalanithi Paul Health, Lungs Cancer Patients United States Biography, Neurosurgeons Biography, Husband and wife","Random House,",[2016],Control
Digital,OverDrive,AUDIOBOOK,2025,5,38,Wild: From Lost to Found on the Pacific Crest Trail (unabridged),9780307970329,Cheryl Strayed,"Biography & Autobiography, Travel, Nonfiction",Books on Tape,2012,Control
Physical,Horizon,BOOK,2025,4,8,The book of delights / Ross Gay.,"1616207922, 9781616207922","Gay, Ross, 1974-","Gay Ross 1974, Life, Joy, Essays","Algonquin Books of Chapel Hill,",2019.,LGBT
Digital,OverDrive,AUDIOBOOK,2025,7,52,When Breath Becomes Air:  (unabridged),9780399566196,Paul Kalanithi,"Biography & Autobiography, Philosophy, Sociology, Nonfiction",Books on Tape,2016,Control
Digital,OverDrive,AUDIOBOOK,2025,9,26,In the Dream House: A Memoir (unabridged),9781684572793,Carmen Maria Machado,"Biography & Autobiography, LGBTQIA+ (Nonfiction), Nonfiction",HighBridge,2020,LGBT
Digital,OverDrive,AUDIOBOOK,2025,7,8,So You Want to Talk about Race:  (unabridged),9781538475317,Ijeoma Oluo,"Politics, Sociology, African American Nonfiction, Nonfiction",Blackstone Publishing,2018,Treatment
Digital,OverDrive,AUDIOBOOK,2025,5,13,So You Want to Talk about Race:  (unabridged),9781538475317,Ijeoma Oluo,"Politics, Sociology, African American Nonfiction, Nonfiction",Blackstone Publishing,2018,Treatment
Physical,Horizon,BOOK,2025,6,3,White fragility : why it's so hard for white people to talk about racism / Robin DiAngelo.,"0807047414, 9780807047415","DiAngelo, Robin, 1956-","Racism, White people, Race relations","Beacon Press,",[2018],Treatment
Digital,OverDrive,AUDIOBOOK,2025,7,13,The Book of (More) Delights: Essays (unabridged),9781668632697,Ross Gay,"Biography & Autobiography, Literary Criticism, African American Nonfiction, Nonfiction",Hachette Audio,2023,LGBT
Digital,OverDrive,Ebook,2025,8,20,Wild: From Lost to Found on the Pacific Crest Trail,9780307957658,Cheryl Strayed,"Biography & Autobiography, Travel, Nonfiction",Knopf Doubleday Publishing Group,2012,Control
Digital,OverDrive,AUDIOBOOK,2025,9,2,The Rules Do Not Apply: A Memoir (unabridged),9780525491965,Ariel Levy,"Biography & Autobiography, Psychology, Sociology, Nonfiction",Books on Tape,2017,LGBT
Digital,OverDrive,AUDIOBOOK,2025,9,7,The Art of War: The Essential Translation of the Classic Book of Life (unabridged),9781624608377,Sun Tzu,"History, Philosophy, Nonfiction",Blackstone Publishing,2005,Control
Digital,OverDrive,AUDIOBOOK,2025,7,7,"Me and White Supremacy: Combat Racism, Change the World, and Become a Good Ancestor (unabridged)",9781094135458,Layla F. Saad,"Self-Improvement, Sociology, Nonfiction",Blackstone Publishing,2020,Treatment
Digital,OverDrive,AUDIOBOOK,2025,6,52,When Breath Becomes Air:  (unabridged),9780399566196,Paul Kalanithi,"Biography & Autobiography, Philosophy, Sociology, Nonfiction",Books on Tape,2016,Control
Digital,OverDrive,EBOOK,2025,9,1,Me and White Supremacy,9781728259109,Layla F. Saad,"Juvenile Nonfiction, Multi-Cultural, Sociology",Sourcebooks,2022,Treatment
Digital,OverDrive,EBOOK,2025,5,139,When Breath Becomes Air,9780812988413,Paul Kalanithi,"Biography & Autobiography, Philosophy, Sociology, Nonfiction",Random House Publishing Group,2016,Control
Physical,Horizon,BOOK,2025,7,6,Untamed / Glennon Doyle.,"1984801252, 9781984801258","Doyle, Glennon, 1976-","Doyle Glennon 1976, Married women United States Biography, Wambach Abby 1980 Family, Lesbians United States Biography, Christian biography, Autobiographies","The Dial Press,",[2020],LGBT
Physical,Horizon,BOOK,2025,5,2,The new Jim Crow : mass incarceration in the age of colorblindness / Michelle Alexander.,"1620971933, 1620975459, 9781620971932, 9781620971949, 9781620975459","Alexander, Michelle","Racism in criminology United States, Criminal justice Administration of United States, Discrimination in criminal justice administration United States, African American prisoners United States, African American men Social conditions, Race discrimination United States, United States Race relations, African Americans Legal status laws etc, African Americans Segregation History, Law for laypersons, Instructional and educational works","New Press,",[2020],Treatment
Digital,OverDrive,AUDIOBOOK,2025,9,89,Between the World and Me:  (unabridged),9780147520517,Ta-Nehisi Coates,"Biography & Autobiography, Sociology, African American Nonfiction, Nonfiction",Books on Tape,2015,Treatment
Digital,OverDrive,EBOOK,2025,5,7,The Book of (More) Delights: Essays,9781643755472,Ross Gay,"Biography & Autobiography, Literary Criticism, African American Nonfiction, Nonfiction",Algonquin Books,2023,LGBT
Physical,Horizon,BOOK,2025,5,3,The color of law : a forgotten history of how our government segregated America / Richard Rothstein.,"1631492853, 9781631492853","Rothstein, Richard","Segregation United States History 20th century, African Americans Segregation History 20th century, Discrimination in housing Government policy United States History 20th century, United States Race relations History 20th century","Liveright Publishing Corporation,",[2017],Treatment
Physical,Horizon,BOOK,2025,6,3,When breath becomes air / Paul Kalanithi ; foreword by Abraham Verghese.,"1410487857, 9781410487858","Kalanithi, Paul","Kalanithi Paul Health, Lungs Cancer Patients United States Biography, Neurosurgeons Biography, Husband and wife","Thorndike Press, a part of Gale, Cengage Learning,",2016.,Control
Digital,OverDrive,AUDIOBOOK,2025,11,15,Bad Feminist: Essays (unabridged),9780062379764,Roxane Gay,"Essays, Sociology, Nonfiction, Humor (Nonfiction)",HarperCollins,2015,LGBT
Physical,Horizon,BOOK,2025,6,3,Bad feminist : essays / Roxane Gay.,"0062282719, 9780062282712","Gay, Roxane","Gay Roxane Anecdotes, Feminism, Popular culture, Women Conduct of life Anecdotes, Race awareness in motion pictures, African Americans in mass media, Essays","Harper Perennial,",c2014.,LGBT
Digital,OverDrive,AUDIOBOOK,2025,2,19,Stamped from the Beginning: A Definitive History of Racist Ideas in America (unabridged),9781518940927,Ibram X. Kendi,"History, African American Nonfiction, Nonfiction",Novel Audio,2017,Treatment
Physical,Horizon,BOOK,2025,5,6,The boys in the boat : nine Americans and their epic quest for gold at the 1936 Berlin Olympics / Daniel James Brown.,"0143125478, 9780143125471","Brown, Daniel James, 1951-","University of Washington Rowing History, Olympic Games 11th 1936 Berlin Germany, Rowing United States History, Rowers United States Biography, Olympics History","Penguin Books,",2014.,Control
Physical,Horizon,BOOK,2025,5,4,The boys in the boat : nine Americans and their epic quest for gold at the 1936 Berlin Olympics / Daniel James Brown.,"1410459543, 9781410459541","Brown, Daniel James, 1951-","University of Washington Rowing History, Rowers United States Biography, Rowing United States History, Olympic Games 11th 1936 Berlin Germany, Large type books","Thorndike Press,",2013.,Control
Digital,OverDrive,AUDIOBOOK,2025,6,30,"The New Jim Crow: Mass Incarceration in the Age of Colorblindness, 10th Anniversary Edition (unabridged)",9781464046162,Michelle Alexander,"Sociology, African American Nonfiction, Nonfiction","Recorded Books, Inc.",2018,Treatment
Digital,OverDrive,AUDIOBOOK,2025,5,4,Naturally Tan: A Memoir (unabridged),9781250211088,Tan France,"Biography & Autobiography, LGBTQIA+ (Nonfiction), Performing Arts, Nonfiction",Macmillan Audio,2019,LGBT
Digital,OverDrive,EBOOK,2025,7,126,When Breath Becomes Air: Pulitzer Prize Finalist,9780812988413,Paul Kalanithi,"Biography & Autobiography, Philosophy, Sociology, Nonfiction",Random House Publishing Group,2016,Control
Physical,Horizon,BOOK,2025,5,2,Hunger : a memoir of (my) body / Roxane Gay.,"0062362593, 0062569716, 9780062362599, 9780062569714","Gay, Roxane","Gay Roxane, Body image, Eating disorders, Autobiographies","Harper, an imprint of HarperCollinsPublishers,",[2017],LGBT
Digital,OverDrive,Ebook,2025,8,42,The Boys in the Boat: Nine Americans and Their Epic Quest for Gold at the 1936 Berlin Olympics,9781101622742,Daniel James Brown,"History, Sports & Recreations, Nonfiction",Penguin Publishing Group,2013,Control
Digital,OverDrive,EBOOK,2025,5,2,Shortest Way Home: One Mayor's Challenge and a Model for America's Future,9781631494376,Pete Buttigieg,"Biography & Autobiography, Politics, Nonfiction",Liveright,2019,LGBT
Digital,OverDrive,Ebook,2025,8,5,Sapiens [Tenth Anniversary Edition]: A Brief History of Humankind,9780063453982,Yuval Noah Harari,"History, Women's Studies, Nonfiction",HarperCollins,2025,Control
Digital,OverDrive,EBOOK,2025,5,17,The Art of War: The Oldest Military Treatise in the World,9781620114650,Sun Tzu,"Business, Politics, Self-Improvement, Nonfiction",Duke Classics,2024,Control
Digital,OverDrive,AUDIOBOOK,2025,9,18,The Boys in the Boat: Nine Americans and Their Epic Quest for Gold at the 1936 Berlin Olympics (unabridged),9780593910641,Daniel James Brown,"History, Sports & Recreations, Nonfiction",Books on Tape,2024,Control
Digital,OverDrive,Ebook,2025,8,49,Between the World and Me,9780679645986,Ta-Nehisi Coates,"Biography & Autobiography, Sociology, African American Nonfiction, Nonfiction",Random House Publishing Group,2015,Treatment
Digital,OverDrive,EBOOK,2025,12,1,Sapiens. Una historia gráfica 1--El nacimiento de la humanidad: .,9788418006937,Yuval Noah Harari,"Comic and Graphic Books, Sociology, Nonfiction",DEBATE,2021,Control
Physical,Horizon,BOOK,2025,6,1,So you want to talk about race / Ijeoma Oluo.,"1580056776, 9781580056779","Oluo, Ijeoma","United States Race relations, Intercultural communication, Racism United States","Seal Press,",2018.,Treatment
Digital,OverDrive,EBOOK,2025,6,1,How to Win Friends and Influence People in the Digital Age,9781451629163,Dale Carnegie,"Business, Psychology, Self-Improvement, Nonfiction",Simon & Schuster,2014,Control
Physical,Horizon,BOOK,2025,5,10,In the dream house : a memoir / Carmen Maria Machado.,"1644450038, 9781644450031","Machado, Carmen Maria","Machado Carmen Maria, Women authors American 21st century Biography, Abused lesbians United States Biography, Lesbians United States Biography","Graywolf Press,",[2019],LGBT
Physical,Horizon,BOOK,2025,5,13,When breath becomes air / Paul Kalanithi ; foreword by Abraham Verghese.,"081298840X, 9780812988406","Kalanithi, Paul","Kalanithi Paul Health, Lungs Cancer Patients United States Biography, Neurosurgeons Biography, Husband and wife","Random House,",[2016],Control
Digital,OverDrive,AUDIOBOOK,2025,9,49,Untamed:  (unabridged),9780593156087,Glennon Doyle,"Biography & Autobiography, Self-Improvement, Nonfiction",Books on Tape,2020,LGBT
Digital,OverDrive,AUDIOBOOK,2025,1,34,The Boys in the Boat: Nine Americans and Their Epic Quest for Gold at the 1936 Berlin Olympics (unabridged),9780593910641,Daniel James Brown,"History, Sports & Recreations, Nonfiction",Books on Tape,2024,Control
Digital,OverDrive,AUDIOBOOK,2025,1,34,In the Dream House: A Memoir (unabridged),9781684572793,Carmen Maria Machado,"Biography & Autobiography, LGBTQIA+ (Nonfiction), Nonfiction",HighBridge Company,2020,LGBT
Digital,OverDrive,EBOOK,2025,1,84,Between the World and Me,9780679645986,Ta-Nehisi Coates,"Biography & Autobiography, Sociology, African American Nonfiction, Nonfiction","Random House, Inc.",2015,Treatment
Physical,Horizon,BOOK,2025,1,11,Untamed / Glennon Doyle.,"1984801252, 9781984801258","Doyle, Glennon, 1976-","Doyle Glennon 1976, Married women United States Biography, Wambach Abby 1980 Family, Lesbians United States Biography, Christian biography, Autobiographies","The Dial Press,",[2020],LGBT
Digital,OverDrive,EBOOK,2025,1,40,The Book of Delights: Essays,9781616208905,Ross Gay,"Biography & Autobiography, Literary Criticism, African American Nonfiction, Nonfiction","Hachette Digital, Inc.",2019,LGBT
Digital,OverDrive,EBOOK,2025,1,30,The New Jim Crow: Mass Incarceration in the Age of Colorblindness,9781620971949,Michelle Alexander,"Law, Politics, Sociology, African American Nonfiction, Nonfiction",Lightning Source Inc,2020,Treatment
Digital,OverDrive,EBOOK,2025,1,26,The Art of War: The Oldest Military Treatise in the World,9781620114650,Sun Tzu,"Business, Politics, Self-Improvement, Nonfiction",Duke Classics,2024,Control
Physical,Horizon,BOOK,2025,1,10,The book of delights / Ross Gay.,"1616207922, 9781616207922","Gay, Ross, 1974-","Gay Ross 1974, Life, Joy, Essays","Algonquin Books of Chapel Hill,",2019.,LGBT
Digital,OverDrive,AUDIOBOOK,2025,1,9,The Art of War: The Essential Translation of the Classic Book of Life (unabridged),9781624608377,Sun Tzu,"History, Philosophy, Nonfiction","Blackstone Audio, Inc.",2005,Control
